{
  "$schema": "./product-profile.schema.json",
  "schemaVersion": 1,
  "product": {
    "name": "SourceNerve",
    "channel": "development",
    "websiteUrl": "https://sourcenerve.fogewise.io.vn/",
    "supportUrl": "https://sourcenerve.fogewise.io.vn/support",
    "privacyUrl": "https://sourcenerve.fogewise.io.vn/privacy",
    "termsUrl": "https://sourcenerve.fogewise.io.vn/terms"
  },
  "plugin": {
    "name": "SourceNerve",
    "description": "Persistent repository intelligence and guarded Git/provider workflows through the installation-scoped SourceNerve MCP server.",
    "iconUrl": "https://sourcenerve.fogewise.io.vn/icon.svg",
    "chatgptSetupUrl": "https://chatgpt.com/"
  },
  "daemon": {
    "managed": true,
    "bind": "127.0.0.1:7331",
    "healthPath": "/healthz",
    "readinessPath": "/api/v1/readiness",
    "mcpPath": "/mcp"
  },
  "desktopBehavior": {
    "allowBackgroundMode": true,
    "allowLaunchAtLogin": true,
    "allowNotifications": true
  },
  "gitProviders": {
    "github": {
      "cli": "gh",
      "hostname": "github.com",
      "apiBaseUrl": "https://api.github.com"
    },
    "gitlab": {
      "cli": "glab",
      "hostname": "gitlab.com",
      "apiBaseUrl": "https://gitlab.com/api/v4"
    }
  },
  "publicMcp": {
    "authentication": "none",
    "routingMode": "bootstrap-broker",
    "hostnameStrategy": "installation-scoped"
  },
  "bootstrapBroker": {
    "baseUrl": "https://sourcenerve.fogewise.io.vn",
    "enrollPath": "/v1/desktop/enroll",
    "rotateTunnelPath": "/v1/desktop/tunnel/rotate",
    "revokePath": "/v1/desktop/revoke",
    "statusPath": "/v1/desktop/bootstrap-status"
  },
  "cloudflare": {
    "mode": "broker-managed",
    "bundleCloudflared": true,
    "desktopReceivesAccountApiToken": false,
    "desktopReceivesInstallationCredential": true
  },
  "installation": {
    "localBearerEntropyBits": 256,
    "generateInstallationId": true,
    "secureStoreRequired": true
  },
  "workspace": {
    "userSelectsRepository": true,
    "userSelectsLocalRoot": true,
    "userSelectsAccessMode": true,
    "deriveProviderMetadata": true
  }
}
